ID,Speaker,HeadProfile,CharLeft,CharMid,CharRight,Text,Background,BGM,Voice,Command,Note
10040001,hide,hide,hide,hide,hide,最后一拨客人离开时，已是深夜。,Manager_Office,Unreal_Memory,,,
10040002,hide,hide,hide,hide,hide,走廊里高跟鞋的声音渐渐稀疏，取而代之的是保洁人员清扫的声音。,Manager_Office,,,,
10040003,hide,hide,hide,hide,hide,空气里混杂着残留的香水，还有像是疲惫渗进木地板后散发出的微酸气味。,Manager_Office,,,,
10040004,hide,hide,hide,hide,hide,我坐在经理室里，面前摊开着第一日的账本。,Manager_Office,,,,
10040005,hide,hide,hide,hide,hide,数字整齐地排列着，却仿佛在纸面上浮动。,Manager_Office,,,,
10040006,hide,hide,hide,hide,hide,每周的额度指标，像悬在头顶的薄刃。,Manager_Office,,,,
10040007,hide,hide,hide,hide,hide,门被轻轻敲响。,Manager_Office,,,,
10040008,hide,hide,hide,hide,hide,不是员工那种小心翼翼的叩击，而是从容的、笃定的三声。,Manager_Office,,,,
10040009,hide,hide,hide,hide,hide,是白鹤姬·桂原雪代。,Manager_Office,,,,
10040010,白鹤姬·桂原雪代,hide,hide,YukiyoKatsurahara_work,hide,经理大人，还在工作么？,Manager_Office,,,,
10040011,hide,hide,hide,YukiyoKatsurahara_work,hide,她仍然没有更换衣服。妆容也未洗净，在昏暗灯光下显出一种瓷器般的苍白。,Manager_Office,,,,
10040012,hide,hide,hide,YukiyoKatsurahara_work,hide,她手里端着一个黑漆托盘，上面放着一只白瓷酒壶和两只酒杯。,Manager_Office,,,,
10040013,白鹤姬·桂原雪代,hide,hide,YukiyoKatsurahara_work,hide,第一天感觉如何？,Manager_Office,,,,
10040014,hide,hide,hide,YukiyoKatsurahara_work,hide,她走进来，将托盘放在茶几上，跪坐下来开始斟酒。,Manager_Office,,,,
10040015,hide,hide,hide,YukiyoKatsurahara_work,hide,动作行云流水，壶口悬停得恰到好处，酒液落入杯中无声。,Manager_Office,,,,
10040016,hide,hide,hide,YukiyoKatsurahara_work,hide,……还在适应。,Manager_Office,,,,
10040017,我,hide,hide,YukiyoKatsurahara_work,hide,啊……谢谢。,Manager_Office,,,,
10040018,hide,hide,hide,YukiyoKatsurahara_work,hide,我接过酒杯表示感谢。,Manager_Office,,,,
10040019,白鹤姬·桂原雪代,hide,hide,YukiyoKatsurahara_work,hide,“十二飞鸟”的夜晚，和你想的一样吗？,Manager_Office,,,,
10040020,hide,hide,hide,YukiyoKatsurahara_work,hide,清酒是温过的，握在掌心有熨帖的温度。,Manager_Office,,,,
10040021,hide,hide,hide,YukiyoKatsurahara_work,hide,我抿了一口，酒里隐约带着梨子般的清甜。,Manager_Office,,,,
10040022,我,hide,hide,YukiyoKatsurahara_work,hide,要比我之前工作的俱乐部安静。,Manager_Office,,,,
10040023,hide,hide,hide,YukiyoKatsurahara_work,hide,听到这里，桂原雪代轻轻一笑。,Manager_Office,,,,
10040024,白鹤姬·桂原雪代,hide,hide,YukiyoKatsurahara_work,hide,安静？,Manager_Office,,,,
10040025,白鹤姬·桂原雪代,hide,hide,YukiyoKatsurahara_work,hide,那可能得益于这里的隔音设计吧！,Manager_Office,,,,
10040026,hide,hide,hide,YukiyoKatsurahara_work,hide,她说得确实没错。,Manager_Office,,,,
10040027,hide,hide,hide,YukiyoKatsurahara_work,hide,这里的建筑墙壁显然要比一般的日式建筑更加厚重。,Manager_Office,,,,
10040028,hide,hide,hide,YukiyoKatsurahara_work,hide,应该在隔音上做了额外的处理。,Manager_Office,,,,
10040029,hide,hide,hide,YukiyoKatsurahara_work,hide,倘若为了那些见不得人的事情做的特殊处理倒也正常。,Manager_Office,,,,
10040030,hide,hide,hide,YukiyoKatsurahara_work,hide,只是我清楚地知道这里可能有更见不得人的事情。,Manager_Office,,,,
10040031,hide,hide,hide,YukiyoKatsurahara_work,hide,在我思索这些的时候，桂原雪代举起酒杯。,Manager_Office,,,,
10040032,hide,hide,hide,YukiyoKatsurahara_work,hide,她将杯中酒一饮而尽，喉颈的线条优美如鹤。,Manager_Office,,,,
10040033,hide,hide,hide,YukiyoKatsurahara_work,hide,我看向她。,Manager_Office,,,,
10040034,hide,hide,hide,YukiyoKatsurahara_work,hide,她的表情没有变化，哪怕喝完酒以后也仍然没有变化。,Manager_Office,,,,
10040035,白鹤姬·桂原雪代,hide,hide,YukiyoKatsurahara_work,hide,经理的眼睛虽然，干净，但是还挺有魅力的……,Manager_Office,,,,
10040036,hide,hide,hide,YukiyoKatsurahara_work,hide,房间里的空气似乎凝滞了一瞬。,Manager_Office,,,,
10040037,hide,hide,hide,YukiyoKatsurahara_work,hide,我搞不清这个危险的女人说这样的话是要做什么。,Manager_Office,,,,
10040038,白鹤姬·桂原雪代,hide,hide,YukiyoKatsurahara_work,hide,经理觉得我的眼睛怎么样？,Manager_Office,,,,
10040039,hide,hide,hide,YukiyoKatsurahara_work,,她的声音很轻，却像细针一样扎进耳膜。,Manager_Office,,,,
10040040,hide,hide,hide,hide,hide,就在这时，敲门声再次响起。,Manager_Office,,,,
10040041,hide,hide,hide,AoiHoshino_base,hide,一个女孩站在门外，穿着便装的简单米色针织衫和牛仔裤，眼神中略显疲惫。,Manager_Office,,,,
10040042,hide,hide,hide,AoiHoshino_base,hide,是“四月·青鹭姬”星野葵。,Manager_Office,,,,
10040043,hide,hide,hide,AoiHoshino_base,hide,我掌握的情报显示，她其实是一个医学院在读的高材生。,Manager_Office,,,,
10040044,hide,hide,hide,AoiHoshino_base,hide,在俱乐部里打工筹措钱来还助学贷,Manager_Office,,,,
10040045,hide,hide,hide,AoiHoshino_base,hide,——同样是日本糟糕的大学金融助学系统的受害者。,Manager_Office,,,,
10040046,青鹭姬·星野葵,hide,hide,AoiHoshino_base,hide,抱歉，打扰。,Manager_Office,,,,
10040047,青鹭姬·星野葵,hide,hide,AoiHoshino_base,hide,我只是来送这个，给经理的见面礼……,Manager_Office,,,,
10040048,hide,hide,hide,AoiHoshino_base,hide,她递过来一个小纸袋。里面是几板维生素B群，还有一小瓶褪黑素。,Manager_Office,,,,
10040049,青鹭姬·星野葵,hide,hide,AoiHoshino_base,hide,这种工作，生物钟很容易紊乱。,Manager_Office,,,,
10040050,青鹭姬·星野葵,hide,hide,AoiHoshino_base,hide,这里有维生素B能缓解压力，褪黑素帮你调整睡眠。,Manager_Office,,,,
10040051,青鹭姬·星野葵,hide,hide,AoiHoshino_base,hide,但注意剂量——褪黑素每天不要超过3毫克。,Manager_Office,,,,
10040052,hide,hide,hide,AoiHoshino_base,hide,她的语气专业得像在嘱咐病人。,Manager_Office,,,,
10040053,hide,hide,hide,AoiHoshino_base,hide,但当她看向茶几上的酒杯时，眉头几不可察地皱了一下。,Manager_Office,,,,
10040054,青鹭姬·星野葵,hide,hide,AoiHoshino_base,hide,酒精会和褪黑素产生反应。,Manager_Office,,,,
10040055,青鹭姬·星野葵,hide,hide,AoiHoshino_base,hide,如果真的要吃，还是别和酒精一起。,Manager_Office,,,,
10040056,hide,hide,AoiHoshino_base,hide,YukiyoKatsurahara_work,随后，她转向桂原雪代。,Manager_Office,,,,
10040057,青鹭姬·星野葵,hide,AoiHoshino_base,hide,YukiyoKatsurahara_work,白鹤姐你也是，要注意休息。,Manager_Office,,,,
10040058,白鹤姬·桂原雪代,hide,AoiHoshino_base,hide,YukiyoKatsurahara_work,多谢关心。青鹭还是这么体贴。,Manager_Office,,,,
10040059,青鹭姬·星野葵,hide,AoiHoshino_base,hide,YukiyoKatsurahara_work,这是我该做的。,Manager_Office,,,,
10040060,青鹭姬·星野葵,hide,AoiHoshino_base,hide,YukiyoKatsurahara_work,那不打扰大家，我先告辞了，我明天早上有课。,Manager_Office,,,,
10040061,hide,hide,AoiHoshino_base,hide,YukiyoKatsurahara_work,她走到门口，她回头又很有礼貌地鞠了一躬。,Manager_Office,,,,
10040062,青鹭姬·星野葵,hide,AoiHoshino_base,hide,YukiyoKatsurahara_work,大家晚安。,Manager_Office,,,,
10040063,hide,hide,hide,hide,hide,门轻轻关上。,Manager_Office,,,,
10040064,hide,hide,hide,hide,hide,空气中留下一丝淡淡的酒精味——不是清酒，而是医用酒精。,Manager_Office,,,,
10040065,hide,hide,hide,hide,hide,应该是星野葵拿来给自己消毒用的。,Manager_Office,,,,
10040066,hide,hide,hide,YukiyoKatsurahara_base,hide,此时，桂原雪代重新端起酒杯。,Manager_Office,,,,
10040067,白鹤姬·桂原雪代,hide,hide,YukiyoKatsurahara_base,hide,她是医学院的高材生。,Manager_Office,,,,
10040068,白鹤姬·桂原雪代,hide,hide,YukiyoKatsurahara_base,hide,你知道为什么这样的女孩会在这里吗？,Manager_Office,,,,
10040069,我,hide,hide,YukiyoKatsurahara_base,hide,为了钱？,Manager_Office,,,,
10040070,白鹤姬·桂原雪代,hide,hide,YukiyoKatsurahara_base,hide,我一般有更好的说法，为了“学习”~,Manager_Office,,,,
10040071,hide,hide,hide,hide,hide,她站起身，走到窗边。窗外，大阪的夜景如繁星铺就的绒毯。,Manager_Office,,,,
10040072,hide,hide,hide,hide,hide,就在此时，门又被敲响了。,Manager_Office,,,,
10040073,hide,hide,hide,hide,hide,这次甚至没等回应，门就被推开。,Manager_Office,,,,
10040074,hide,hide,hide,Linda_work,hide,是“朱雀姬”Linda，俄罗斯血统，用来满足客人多样化的需求。,Manager_Office,,,,
10040075,hide,hide,hide,Linda_work,hide,Linda倚在门框上。她已经换下接客时的华丽服装。,Manager_Office,,,,
10040076,hide,hide,hide,Linda_work,hide,穿着简单但是性感的短裙，金色的长发随意披散。,Manager_Office,,,,
10040077,hide,hide,hide,Linda_work,hide,手里夹着一支细长的女士香烟。,Manager_Office,,,,
10040078,朱雀姬·Linda,hide,hide,Linda_work,hide,啊，还在开会？,Manager_Office,,,,
10040079,hide,hide,hide,Linda_work,hide,她的日语确实明显带有口音。,Manager_Office,,,,
10040080,hide,hide,hide,Linda_work,hide,她走进来，很自然地坐到桂原雪代刚才的位置，拿起酒壶晃了晃。,Manager_Office,,,,
10040081,朱雀姬·Linda,hide,hide,Linda_work,hide,诶，酒不错嘛。,Manager_Office,,,,
10040082,hide,hide,hide,Linda_work,hide,说着她便给自己倒了一杯。,Manager_Office,,,,
10040083,朱雀姬·Linda,hide,hide,Linda_work,hide,第一天怎么样，经理先生？,Manager_Office,,,,
10040084,朱雀姬·Linda,hide,hide,Linda_work,hide,听说经理身经百战，应该适应得很好吧~,Manager_Office,,,,
10040085,白鹤姬·桂原雪代,hide,hide,YukiyoKatsurahara_angry,,朱雀，注意礼节。,Manager_Office,,,,
10040086,朱雀姬·Linda,hide,hide,Linda_work,hide,抱歉抱歉。在我们那儿，下班后大家都是朋友。,Manager_Office,,,,
10040087,朱雀姬·Linda,hide,hide,Linda_work,hide,不过说真的，经理大人适应得比我想象的快。,Manager_Office,,,,
10040088,hide,hide,hide,Linda_work,hide,她靠近了我一些，蓝色的眼睛在灯光下像是猫科动物。,Manager_Office,,,,
10040089,朱雀姬·Linda,hide,hide,Linda_work,hide,有什么秘诀吗？还是说……,Manager_Office,,,,
10040090,朱雀姬·Linda,hide,hide,Linda_work,hide,经理你就是天生擅长这个？,Manager_Office,,,,
10040091,hide,hide,hide,Linda_work,hide,天生擅长？那可能对我这个警察来说也未免有些讽刺……,Manager_Office,,,,
10040092,我,hide,hide,Linda_work,hide,……咳咳，也许是吧。,Manager_Office,,,,
10040093,白鹤姬·桂原雪代,hide,hide,YukiyoKatsurahara_angry,,Linda。,Manager_Office,,,,
10040094,朱雀姬·Linda,hide,hide,Linda_work,hide,好吧，好吧，不打扰你们开会了。,Manager_Office,,,,
10040095,朱雀姬·Linda,hide,hide,Linda_work,hide,我只是来告别的。,Manager_Office,,,,
10040096,朱雀姬·Linda,hide,hide,Linda_work,hide,明天我要陪一个法国人去神户，三天后回来。,Manager_Office,,,,
10040097,朱雀姬·Linda,hide,hide,Linda_work,hide,byebye~☆,Manager_Office,,,,
10040098,hide,hide,hide,hide,hide,房间里瞬间安静。,Manager_Office,,,,
10040099,hide,hide,hide,hide,hide,门关上后，房间里只剩下我和桂原雪代。,Manager_Office,,,,
10040100,hide,hide,hide,hide,hide,她重新坐回茶几前，开始收拾酒杯。,Manager_Office,,,,
10040101,白鹤姬·桂原雪代,hide,hide,YukiyoKatsurahara_base,hide,Linda是俄罗斯人，但母亲是日本人。,Manager_Office,,,,
10040102,白鹤姬·桂原雪代,hide,hide,YukiyoKatsurahara_base,hide,她在五个国家长大，会七种语言。,Manager_Office,,,,
10040103,白鹤姬·桂原雪代,hide,hide,YukiyoKatsurahara_base,hide,这些女人各有各的麻烦，不过，也各有各的用处。,Manager_Office,,,,
10040104,hide,hide,hide,YukiyoKatsurahara_base,hide,她回头看了我一眼。那双眼睛在昏暗光线中闪烁。,Manager_Office,,,,
10040105,白鹤姬·桂原雪代,hide,hide,YukiyoKatsurahara_base,hide,好了不打扰了，我也该去休息了。,Manager_Office,,,,
10040106,白鹤姬·桂原雪代,hide,hide,YukiyoKatsurahara_base,hide,晚安，黑羽经理。,Manager_Office,,,,
10040107,白鹤姬·桂原雪代,hide,hide,YukiyoKatsurahara_base,hide,愿你……做个好梦。,Manager_Office,,,,
10040108,hide,hide,hide,hide,hide,门轻轻合上。,Manager_Office,,,,
10040109,hide,hide,hide,hide,hide,我独自坐在房间里，窗外，大阪的夜景依旧璀璨。,Manager_Office,,,,
10040110,hide,hide,hide,hide,hide,但在这个房间里，我隐隐有种感觉——,Manager_Office,,,,
10040111,hide,hide,hide,hide,hide,我踏入的不仅是一家高档的风俗店。,Manager_Office,,,,
10040112,hide,hide,hide,hide,hide,是一个巨大的、精致的、危险的鸟笼。,Manager_Office,,,,
10040113,hide,hide,hide,hide,hide,而笼中的每只鸟，都在静静观察着新来的同伴。,Manager_Office,,,,
10040114,hide,hide,hide,hide,hide,判断他是会唱歌的金丝雀，还是……带来霉运的乌鸦。,Manager_Office,,,,
10040115,hide,hide,hide,hide,hide,但是，在这个夜晚，我的工作仍然没有结束……,Manager_Office,,,,
10040115,hide,hide,hide,hide,hide,回到公寓时，已是很深的夜。,Home,Mixed_Emotion,,,
10040115,hide,hide,hide,hide,hide,钥匙在锁孔里转动的声音格外响亮，在空旷的走廊里荡出回音。,Home,,,,
10040116,hide,hide,hide,hide,hide,这间位于淀川区边缘的单身公寓，是警方为我准备的“黑羽哲也”的住所,Home,,,,
10040117,hide,hide,hide,hide,hide,——六叠大的和室，榻榻米已有些发黑，壁纸在角落处微微卷起。,Home,,,,
10040118,hide,hide,hide,hide,hide,唯一的窗户正对着一栋办公楼的后墙，即使白天也少有阳光光顾。,Home,,,,
10040119,hide,hide,hide,hide,hide,我脱下西装外套，随手扔在榻榻米上。,Home,,,,
10040120,hide,hide,hide,hide,hide,领带解开时，感觉脖颈处有被勒紧一整天的印痕。,Home,,,,
10040121,hide,hide,hide,hide,hide,空气里有灰尘和旧木头的气味，混杂着从俱乐部带回来的、依附在衣物上的香水与酒精的残留。,Home,,,,
10040122,hide,hide,hide,hide,hide,身体很重。,Home,,,,
10040123,hide,hide,hide,hide,hide,不是肌肉的疲惫，是更深处的、仿佛骨髓都被抽空的那种重量。,Home,,,,
10040124,hide,hide,hide,hide,hide,我从公文包夹层取出那部老式翻盖手机,Home,,,,
10040125,hide,hide,hide,hide,hide,——黑色的，没有任何品牌标识，键盘上的数字已被磨得光滑。,Home,,,,
10040126,hide,hide,hide,hide,hide,这是增田课长给的联络工具，只能存储一个号码，只能发送加密文本。,Home,,,,
10040127,hide,hide,hide,hide,hide,我坐到窗边那把唯一的椅子上，开始输入。,Home,,,,
10040128,hide,hide,hide,hide,hide,手指在按键上移动时，能感觉到指尖的细微颤抖。,Home,,,,
10040129,hide,hide,hide,hide,hide,发送信息：“已入鸟笼，一切正常”,Home,,,,
10040130,hide,hide,hide,hide,hide,很快，我收到了一则简单的回复：“OK”。,Home,,,,
10040131,hide,hide,hide,hide,hide,虽然简短，但是知道来自增田课长，他深夜仍然在等我的消息，就会觉得有些安心。,Home,,,,
10040132,hide,hide,hide,hide,hide,我走到狭窄的淋浴间。,Home,,,,
10040133,hide,hide,hide,hide,hide,热水从花洒涌出时，蒸汽迅速弥漫了这片不到两平方米的空间。,Home,,,,
10040134,hide,hide,hide,hide,hide,水很烫，皮肤很快泛红，但肌肉深处的寒意似乎仍未散去。,Home,,,,
10040135,hide,hide,hide,hide,hide,热水顺着脊背流淌。我突然想起北海道的澡堂。,Home,,,,
10040136,hide,hide,hide,hide,hide,小时候，父亲常带我去镇上的钱汤。,Home,,,,
10040137,hide,hide,hide,hide,hide,那是砖砌的大浴池，水总是烫得让人需要一点点适应。,Home,,,,
10040138,hide,hide,hide,hide,hide,父亲会坐在池边，点一支烟，说些捕鱼的事。,Home,,,,
10040139,hide,hide,hide,hide,hide,那时的水汽里是肥皂和硫磺的味道，简单，明确。,Home,,,,
10040140,hide,hide,hide,hide,hide,而现在，水汽里是俱乐部带回来的、无法洗净的复杂气味。,Home,,,,
10040141,hide,hide,hide,hide,hide,不过好在，由于是风俗俱乐部的卧底，晚上才需要上班。,Home,,,,
10040142,hide,hide,hide,hide,hide,明天白天我可以睡一个懒觉……,Home,,,,
10040143,hide,hide,hide,hide,hide,,Home,,,"loadScript(Day_2_morning_FirstCall,10050001)",
